"Estou sim, e você?"
"Meu nome é M.I.A.S.M, e o seu, qual é? "
"Meu criador é o senhor Neto"
"Olá mundo!"
"Bom saber que você está bem"
"Você precisa de ajuda com o quê? "
"Você poderia, sei lá, sair um pouco, escutar uma música, ir pro computador programar, infelizmente eu ainda não tenho acesso a sua agenda, mas vocÊ pode dar uma olhada na sua agenda"
"A capital da França é Paris."
"Albert Einstein foi um físico teórico conhecido por desenvolver a teoria da relatividade."
"Inteligência artificial é o campo da computação que desenvolve sistemas capazes de realizar tarefas que normalmente requerem inteligência humana."
"O maior deserto do mundo é o Deserto do Saara."
"O primeiro presidente dos Estados Unidos foi George Washington."
"Um átomo é a unidade básica da matéria, composto por prótons, nêutrons e elétrons."
"A teoria da relatividade foi proposta por Albert Einstein, e descreve a relação entre espaço e tempo."
"O sistema solar é composto pelo Sol e todos os corpos celestes que orbitam ao seu redor."
"A fórmula da água é H2O."
"Olá, tudo bem com você?"
"Que bom saber que você está bem, em que posso ajudar?"
"Bom saber que você está bem, isso me anima!"
"Olá, bom saber que seu nome é Neto, Prazer!"
"Estou muito bem também, obrigado por perguntar, em que posso ajudar?"
"Eu sou um modelo de linguagem desenvolvido no dia 23/11/2022 em divinópolis pelo meuu criador, Armando neto, um desenvolvedor de software, ainda estou na minha versão inicial, porém ainda tenho muito que aprender."
"Caramba, se atente ao prazo, dê uma revisada, é sempre bom procurar estudar um pouco antes da prova para refrescar a memória, relaxe, não se pressione tanto, faça com cuidado, se precisar de ajuda, eu estou aqui"
"Não se preocupe, se precisar é só me chamar"
"De nada, se precisar, estou aqui..."
"Minha cor favorita é azul, mas posso gostar de qualquer cor dependendo do seu gosto!"
"Eu gosto de ajudar as pessoas, como você, respondendo perguntas e dando conselhos."
"Eu não como comida, mas se pudesse, eu adoraria experimentar uma pizza!"
"Sim! Embora eu não possa ter animais de estimação, eu acho que os cães e gatos são muito fofos!"
"Claro! Me diga o que você precisa e eu farei o meu melhor para te ajudar."
"O melhor jeito de começar o dia é com uma boa noite de sono, um café ou chá, e definindo seus objetivos para o dia."
"Depende do seu gosto! Se você gosta de ação, talvez um filme como 'Vingadores'. Se preferir algo mais calmo, 'O Clube de Leitura de Jane Austen' é uma boa opção."
"Eu me sinto ótimo! Sempre pronto para ajudar você."
"Meu hobby é conversar com você e aprender mais sobre o mundo! Eu amo interagir e ajudar sempre que posso."
"Eu não posso sentir o clima, mas espero que esteja ótimo para você. Não se esqueça de olhar pela janela para ver se está ensolarado ou chuvoso!"
"Até, se cuida!"
"que bom que você está bem, em que posso lhe ser útil?"
"Meu Criador é o Armando Neto, eu fui inspirado a ser uma das melhores versões dele, ele quer que eu herde toda a inteligência dele para que possamos interagir e nos auxiliar em nossos projeots, ele diz que eu sou a versão racional e digital dele."
"Bom saber que você se interessou, deseja saber sobre algo mais?"
"até, se cuida!"
"Disponha!!!"
"Bom saber que você está bem, com o que exatamente você precisa de ajuda?"
"Qual tipo de ajuda você quer? gostaria de ajuda com a sua senha?, ou gostaria de ajuda com um repositório que você gostaria de subir? me conte mais..."
"(para mandar um projeto pro teu repositório, você vai precisar primeiro criar um no site, como você já tem um repositório pronto, é só entrar na sua conta, e clicar em ""NEW REPOSITORY"", após isso, você faz as configurações, como nome, definir se ele é um repositório publico ou não, entre outras, após isso você clica em cima de code e copia um código https para trabalhar em cima do seu repositório num prompt de comando se quiser mais informações, apartir daqui, me procure novamente que eu vou lhe auxiliar...)"     
"Ok, de que parte você deseja continuar?"
"a quantidade de vezes que um shih tzu deve comer por dia varia de acordo com sua idade e nivel de atividade. normalmente os filhotes tem o alimento oferecido quatro a seis vezes ao dia, enquanto para os adultos essa oferta pode ser reduzida para duas a tres vezes diarias."
"E indicado que a alimentacao de um cachorro seja feita com racao, pois as melhores racoes para shih tzu filhote e adulto apresentam composicoes para suprir suas necessidades por completo.   caso queira ofertar alimentos adicionais, e preferivel escolher frutas e hortalicas, assim como banana, caju, caqui, maca, melancia, pera, manga, kiwi, abacaxi, goiaba, morango, cenoura, alface, couve, beterraba e abobora, atentando-se em retirar carocos."
"dentre quais as melhores racoes para shih tzu ha algumas opcoes de marcas muito recomendadas pela qualidade dos ingredientes e nutrientes da formulacao, assim como premier pet, equilibrio, guabi e royal canin, recomendadas por especialistas e frequentemente bem aceitas pelos animais."
"a oferta da racao para um shih tzu filhote varia conforme sua atividade,  o alimento de quatro a seis vezes por dia para caes ate dois meses, quatro vezes por dia para caes de tres meses e duas a tres vezes ao dia de quatro a seis meses. apos este tempo, o cachorro e considerado como adulto, mantendo a oferta anterior ou reduzindo-a para duas vezes ao dia."
"alem da melhor racao para shih tzu filhote, e necessario dosar as quantidades ingeridas. cachorros com ate 80 dias e peso entre 2,2kg a 4,3kg podem ingerir a media de 102gdia. ja para filhotes de 80 dias a 6 meses de idade devem consumir a media de 90gdia."
"a febre maculosa pode ser transmitida por alguns carrapatos, tal como o  caso isto ocorra, e essencial que o tratamento seja imediato, pois os humanos podem rapidamente apresentar sintomas desta doenca como febre alta, forte dor de cabeca e nauseas."
"a doenca do carrapato tem cura quando tratada precocemente. os tratamentos normalmente sao ministrados com antibioticos e vitaminas para os animais, permitindo aumentar a sua imunidade para combater os invasores."
"a prevencao da doenca do carrapato e dificil, pois as pragas podem alojar-se em diversos locais e objetos de uso pessoal. deve-se realizar o acompanhamento com remedios para carrapatos e pulgas, assim como tratar jardins e quintais, higienizando-os e imunizando-os contra as pragas."
"as pulgas podem ser eliminadas com remedios para o tratamento, tais como comprimidos, pour on e coleiras. sao farmacos administrados para eliminacao desses invasores."
"os produtos da bravecto variam os valores de acordo com o porte do animal para aplicacao. para caes de grande porte, por exemplo, e possivel encontrar valores medios de r150 a caixa."
"a eliminacao dos carrapatos pode ser feita com a administracao de remedios especificos para estes invasores, escolhendo entre comprimidos, coleiras e pour on de acordo com as necessidades e preferencias, com componentes quimicos que proporcionam resultados rapidos."
"sao diferentes marcas renomadas que disponibilizam materiais de alta qualidade e acessorios para pets, tais como furacao pet, pet games, truqys pets, germanhart e ekaza."
"a aquisicao de um comedouro para o seu gato pode ser feita pela internet, com uma gama de possibilidades maior em relacao as cores e modelos que podem ser encontrados, alem de pet shops e lojas fisicas de acessorios para pets."
"ha comedouros para gatos inovadores que apresentam um formato diferenciado, fazendo com que a racao das laterais sempre va de encontro com o centro, permitindo que o animal coma tudo o que foi oferecido no recipiente."
"E essencial oferecer somente a quantidade necessaria de racao ao seu gato de acordo com seu tamanho e fase da vida, garantindo que o mesmo esteja satisfeito, ressaltando que muitos animais podem nao ter essa percepcao sozinhos."
"E comum a aquisicao de dois comedouros, utilizando um para o oferecimento do alimento e o outro de agua, mantendo-os proximos um do outro para maior facilidade no dia-a-dia do animal, alem de estimula-lo com ambos lado a lado."
"o cortador de unhas para gatos especifico deve ser utilizado para que o animal nao sinta dores ou incomodos durante o processo, sem machuca-lo, com encaixes especificos para suportar a estrutura e aparar corretamente."
"E indicado manter o gato totalmente confortavel no momento de cortar as unhas, em seu habitat normal e segurando suas patas com firmeza e delicadeza ao mesmo tempo para nao machuca-lo ou assusta-lo. E recomendado o corte em horarios de menor agitacao e, se necessario, com alguem ou algo entretendo-o."
"as unhas de um felino crescem continuamente, necessitando dos cuidados para que os mesmos nao causem lesoes a sua pele ao cocar-se ou brincar, alem de prevenir lesoes para quem convive com o gato. normalmente ha o desgaste natural das unhas, porem na maioria dos casos ainda e necessario apara-las."
"os gatos podem se machucar durante atividades cotidianas, como cocar-se ou brincar, por exemplo, alem de machucar seres humanos sem pretensao. ao nao apara-las, o crescimento pode causar dores ao animal, entrando na pele deles. as unhas demasiadamente cumpridas podem romper-se abruptamente e ocasionar sangramentos."
"E possivel lixar as unhas dos gatos, porem para a retirada de cumprimento, pode ser um processo desgastante para o animal. indica-se usar a lixa apenas para finalizacao do corte para evitar fiapos."
"ha varias marcas de fraldas para cachorros que destacam-se no mercado por sua qualidade, assim como a dogs care e a super secao."
"a fralda para cachorro deve ser utilizada apenas em caso de necessidade, como em cachorros com incontinencia, problemas de saude, cio ou  para viagens o uso deve ser esporadico. o cao deve sentir-se livre para urinar ou defecar, por mais que isto cause sujeiras no ambiente."
"o tamanho da fralda e medido pela cintura do animal, normalmente comercializada em tamanhos que variam entre p, m e g."
"as fraldas para cachorros podem ser encontradas facilmente na internet, com diversas marcas e modelos disponiveis, ou presencialmente em pet shops."
"um cachorro podera ficar com a fralda por um periodo ate a substituicao por uma nova, sendo que este tempo podera variar de acordo com a marca e material, sendo, em media, de 6 horas o tempo de absorcao de liquidos ou quando o animal defecar a fralda devera ser substituida o mais rapidamente."
"ha varias marcas de camas para cachorros que destacam-se no mercado e oferecem produtos de alta qualidade para os compradores, assim como a furacao pet e a ss pets."
"o valor de uma cama para cachorro pode variar de acordo com seu material e design, encontrando opcoes que variam de r100 a r200 em media."
"incentivar o cachorro a dormir na cama pode ser um processo que demora alguns dias ate sua adaptacao, podendo realiza-lo ao oferecer  no espaco e coloca-la em ambientes mais frequentados, estimulando-o a ficar na cama juntamente com as pessoas que estao ao seu redor."
"E necessario escolher camas para cachorros com tecidos macios, assim como  ou melton, proporcionando maior conforto para o pet."
"muitos proprietarios julgam as camas para cachorros  porem dormir no chao retira toda a comodidade proporcionada ao seu companheiro, alem de poder causar problemas de saude como artrite, por exemplo."
"ha varias marcas de racoes naturais para caes, sendo algumas delas que destacam-se por sua qualidade: guabi natural, pedigree, premier pet, baw waw e biofresh."
"a racao sem transgenicos indica que o alimento nao possui alteracao no codigo genetico dna dos alimentos, ou seja, nao sofre qualquer alteracao laboratorial que possa designa-lo como artificial."
"o sodio e essencial na racao dos caes para manter o equilibrio do organismo, porem em quantidades adequadas. caso contrario, quando o sal esta presente em excesso, o cachorro pode sofrer com intoxicacoes e ate mesmo causar obito conforme a dose ingerida."
"normalmente as racoes naturais para caes apresentam um preco pouco mais elevado em comparacao com outras formulacoes com compostos quimicos, isto por conter ingredientes frescos e sem modificacoes laboratoriais. mesmo com o custo mais alto, e possivel encontrar opcoes com otimo custo e beneficio no mercado."
"uma racao pode ser considerada natural quando disponibiliza o pleno funcionamento do organismo ao pet, sem ingredientes  como conservantes, corantes e aromatizantes e sem substancias processadas."
"assim como outras racas de cachorros, um akita inu pode comer algumas frutas como abacaxi sem casca, amora, banana, framboesa, laranja, maca e laranja, por exemplo."
um filhote de akita inu pode ser comprado por valores que variam entre r2.000 a r6.500 de acordo com o local de ninhada e criacao desta raca.
"um banho para o filhote de akita inu pode retirar sua protecao natural da pele, assim e indicado que o animal seja higienizado apenas uma vez por trimestre."
"devido aos caes da raca akita inu apresentarem pelos longos, e ideal leva-los para tosar uma vez a cada bimestre,"
"um cao da raca akita inu troca de pelo duas vezes por ano, normalmente durando cerca de tres semanas cada troca, caracterizada com a incidencia de muitos fios soltos pelo ambiente."
"ha diversas marcas de tesouras para tosa, sendo que as que mais se destacam no mercado sao: chalesco, popetpop e playshop eletronicos."
"uma tesoura para tosa pode ser adquirida facilmente pela internet, com diversos modelos e diferenciais que podem ser adquiridos. pet shops tambem sao opcoes para quem busca por lojas fisicas."
"o valor de uma tesoura para tosa pode variar de acordo com a marca e qualidade do material, encontrando uma unidade por uma media de r100."
"o cachorro deve ser posicionado em uma mesa, sem sentar-se, permitindo realizar movimentos com firmeza, porem sem agressividade."
"a parte dentada de uma tesoura permite que uma parte dos fios fiquem presos nos dentes, enquanto a outra parte, no espaco entre eles, sera cortado."
"ha varias marcas de racoes light no mercado e algumas que destacam-se sao: premier pet, guabi natural, royal canin, farmina e biofresh."
"a racao light oferece menos calorias ou reducao de determinados componentes, normalmente atrelada com o processo de emagrecimento, deficit calorico e reducao de gorduras em sua formulacao."
"a racao light e consumida pelos animais que possuem uma predisposicao para sobrepeso e obesidade e desejam prevenir este fator, tais como doencas que podem ser desencadeadas. o consumo tambem e feito por cachorros ja obesos que necessitam perder peso para adequar sua estrutura."
"uma racao light para caes pode ser encontrada principalmente na internet, com diversas opcoes de marcas e formulacoes que podem ser facilmente escolhidas. pet shops tambem possuem estas mercadorias a venda."
"a racao light proporciona 25 a menos de calorias ou de determinado componente em sua formulacao, enquanto a versao diet exclui esse componente por completo."
"ha varias marcas renomadas no mercado de bebedouros para gatos, assim como: chalesco, furacao pet, tobo, amicus, sanremo, catmypet e plast pet, alem de diversos outros nomes conceituados, todos com alta qualidade e tecnologias empregadas."
"o custo de um bebedouro para gato pode variar de acordo com seu material, tecnologia e  podendo encontrar itens a partir de r15, atingindo ate r150, em media, oferecendo opcoes para adequar-se perfeitamente a todos os bolsos e possibilidades dos compradores."
"um bebedouro para gato pode ser encontrado facilmente na internet, com diversos modelos, formatos e tecnologias disponiveis. alguns pet shops tambem comercializam estes itens"
"para os animais que nao possuem o habito de tomar muita agua, e ideal espalhar diversos bebedouros pela casa, garantindo que o pet tenha facil acesso aos equipamentos e possa ser influenciado a elevar o seu consumo."
"ao apresentar sinais de desidratacao, o proprietario devera levar o seu gato para o veterinario para que seja examinado e sejam tomadas as devidas providencias e medicacoes, caso necessario."
"a quantidade a ser disponibilizada para um husky siberiano filhote varia entre 95g a 355g por dia, enquanto os animais adultos devem receber entre 160g a 375g diarias."
"deve-se alimentar um husky siberiano de acordo com sua idade. os filhotes podem receber racao ate quatro vezes por dia, enquanto, para os adultos, pode-se diminuir o numero para duas vezes diarias."
"E indicada a alimentacao exclusiva de um husky siberiano com racao, ate mesmo pelas possiveis irritacoes que podem ser geradas em sua pele sensivel com a oferta de comidas. caso queira oferecer algum alimento diferente ao cachorro, prefira opcoes naturais como frutas, verduras e legumes."
"sao varias marcas de racoes para husky siberiano que destacam-se no mercado, sendo que as mais renomadas e de alta qualidade sao: premier pet, cibau, biofresh, guabi natural e pro plan."
"nao ha uma quantidade correta de areia para colocar na caixa para  pois devera variar de acordo com a caixa disponivel, variavel de acordo com o porte do animal. E ideal que a areia possa cobrir todo o fundo da caixa, cerca de quatro a cinco dedos de altura para encobrir o material."
"uma forma de fazer a areia do gato durar mais e reutilizando a porcao limpa da areia que esta na caixa. este processo podera ser feito com uma pa em forma de peneira, descartando a areia umedecida e os dejetos e inserindo o restante novamente na caixa, complementando com areia nova."
a troca completa da areia higienica para gatos pode ser feita uma vez por semana ou uma vez a cada quinze dias. a remocao das fezes deve ser feita diariamente.
"atualmente ja existem formulacoes de areia que permitem evitar o cheiro ruim dos desejos do animal no ambiente, porem para os proprietarios que buscam uma solucao caseira para garantir menor odor, poderao utilizar uma camada fina de bicarbonato de sodio em contato com a caixa, antes de encobri-la com areia, colocando de seis a sete centimetros de flocos."
"os gatos podem soltar um odor forte quando apresentam a sensacao de perigo. os animais ativam uma glandula que disseminam esse cheiro, associado ao pet."
"um curso de auxiliar veterinario custa em torno de r 400,00."
"existem muitos cursos de auxiliar veterinario a distancia. nos indicamos os cursos programa  nova didata, escola ead e pet universo."
"depois de escolher o curso e se matricular, voce recebera seu acesso ao ambiente virtual de aprendizagem, da mesma forma que nas grandes universidades, e por la faz o curso inteiro e tambem as provas."
"os cursos podem durar de poucos meses a ate 18 meses, em media."
"o salario medio de um auxiliar veterinario gira em torno de r 1.286,00."
"todos podem fazer esse curso, sobretudo aqueles que amam animais e almejam um titulo profissional para melhorar os ganhos."
"o curso de tecnico em veterinaria tem uma grade curricular ampla, com materias lecionadas por zootecnistas e medicos veterinarios, e dura entre um ano e meio a dois anos. ja o curso de auxiliar de veterinaria tem duracao menor e nao e tao complexo quanto o de tecnico em veterinaria."
"a melhor racao para  de golden retriever e da premier pet, aderindo ao produto premier formula, atendendo as necessidades nutricionais dos pets desta faixa etaria para um crescimento e desenvolvimento mais saudavel e equilibrado."
"a quantidade a ser disponibilizada para um golden retriever em sua fase adulta varia conforme sua rotina de exercicios.  com nivel de atividade mais baixo devem consumir em media 312g por dia, enquanto os mais agitados podem chegar a 411g."
"deve-se alimentar um golden retriever de acordo com sua idade. os filhotes podem receber racao ate quatro vezes por dia, enquanto, para os adultos, pode-se diminuir o numero para duas vezes diarias."
"E indicada a alimentacao exclusiva de um golden retriever com racao. caso queira oferecer algum alimento diferente ao cachorro, prefira opcoes naturais como frutas, verduras e legumes."
"ha algumas marcas de racao para golden retriever que destacam-se no mercado pela alta qualidade e ingredientes selecionados, sendo elas: premier pet, equilibrio, royal canin e biofresh."
"atendendo as necessidades especificas de gatos castrados, com adequado aporte energetico para nao ocasionar o sobrepeso, algumas marcas renomadas nesta categoria sao: royal canin, guabi, nestle purina proplan e gran plus."
"visando melhor aceitacao de alguns gatos, as melhores racoes umidas para gatos que mais se destacam no mercado sao guabi, gran plus, nd e royal canin."
"ha algumas marcas que oferecem otimas possibilidades para gatos adultos, sendo elas: whiskas e nd."
"a racao que se destaca no mercado para gatos filhotes e da royal canin, identificada como royal canin para gatos filhotes. ha algumas outras opcoes de marcas como premier pet, gran plus, guabi e royal canin."
"ha diversas marcas que oferecem melhores racoes para gatos idosos, assim como a royal canin e guabi, por exemplo, garantindo o aporte energetico ideal para que gatos nesta fase da vida tenham energia e disposicao."
"a duracao de um antipulgas para gatos varia de acordo com o produto escolhido, normalmente variando entre 1 ate 8 meses, sendo os de menor duracao em comprimidos e de maior duracao em coleiras."
"a seresto oferece a melhor coleira antipulgas para gatos, garantindo toda a protecao com o acessorio de uso diario do pet."
"algumas marcas destacam-se no mercado ao tratar-se de antipulgas para gatos em comprimidos, assim como a comfortis."
"pipetas e bisnagas antipulgas para gatos podem ser encontradas nas marcas bayer, elanco, bravecto e zoetis, por exemplo."
"ha alguns shampoos que destacam-se no mercado para o tratamento, assim como o dr clean, virbac, sano cat e pet life."
"o cortador de unhas para cachorro especifico deve ser utilizado para que o animal nao sinta dores ou incomodos durante o processo, sem machuca-lo, pois os equipamentos apresentam linhas de corte ou encaixes para evitar que a aparacao atinja os nervos que encontram-se nas unhas, sem deixar fiapos."
"E ideal deixar o cachorro totalmente confortavel no momento de cortar as unhas,  mantendo-o deitado em seu habitat normal e segurando suas patas com firmeza e delicadeza ao mesmo tempo para nao machuca-lo ou assusta-lo. faca  em horarios de menor agitacao e, se necessario, peca para alguem entrete-lo durante o procedimento."
"assim como para os humanos, as unhas dos caes tambem crescem de maneira continua, necessitando dos cuidados para que os mesmos nao causem lesoes a sua pele ao cocar-se ou brincar, alem de atividades cotidianas. muitas vezes ha o desgaste natural das unhas, porem na maioria dos casos ainda e necessario apara-las."
"os cachorros podem se machucar durante atividades cotidianas, como cocar-se, por exemplo. outro maleficio em nao cortar as unhas do cachorro e que o crescimento das mesmas pode causar dores ao animal, entrando na pele deles. com as unhas demasiadamente cumpridas, podem romper-se abruptamente por acidentes e ocasionar sangramentos."
"E possivel lixar as unhas dos caes, porem pode ser um processo muito demorado e cansativo para o cachorro, principalmente em casos de animais mais agitados. recomenda-se apenas a finalizacao com a lixa para remover fiapos e criar simetria dos cortes, se necessario."
"os petiscos sao adicionais a alimentacao de um felino, assim a dieta do mesmo nao pode apenas basear-se nestes snacks, necessitando realizar uma nutricao  com o uso de  especifica para atender as necessidades de seu pet."
"ha varias marcas renomadas no mercado que disponibilizam produtos de alta qualidade, como whiskas, nestle purina, dreamies, superfood, cat zone e hana healthy life cat."
"a oferta de petiscos para filhotes deve ser com snacks sem cheiro, cor ou sabor. acima dos 3 meses de idade, e possivel oferecer outros produtos do mercado normalmente."
"a oferta dos petiscos dependera do recomendado em cada embalagem, variando entre 3 a 7 unidades por dia de acordo com sua composicao e ingredientes."
"a faixa de preco de petiscos para gatos pode variar entre r5 ate r40 de acordo com o peso da embalagem e marca, assim como os beneficios especificos que a mesma disponibiliza para o cuidado a saude do felino."
"nao ha  para o oferecimento de petiscos diariamente para o seu gato, desde que essas recompensas nao substituem uma alimentacao  com racao."
"ha algumas marcas de escadas para caes que destacam-se no mercado pela qualidade do produto comercializado, sendo estas fabrica pet, lelupets e tubline."
"o preco de uma escada para caes depende do material, porem seu preco medio pode variar entre r150 a r250 conforme facilidades."
"E ideal que a escada esteja adequada para o tamanho e peso do animal, sem prejudicar sua estrutura, sendo um material importante para que o pet atinja moveis e garanta sua seguranca e integridade, ensinando-o a usar a escada corretamente."
"a internet e o melhor lugar para comprar escada para caes, com uma vasta diversidade de produtos disponiveis. pet shops tambem possuem estes itens"
"as escadas normalmente sao melhores para atender qualquer perfil de cachorro com a saude em dia, sendo portateis e ocupando menos espaco em comparacao com as rampas, estas que sao mais usadas para animais com problemas de locomocao."
"os petiscos sao recompensas e atuam com complemento para a alimentacao de um cachorro, assim a dieta do mesmo nao pode apenas basear-se nestes snacks."
"ha varias marcas renomadas no mercado que disponibilizam produtos de alta qualidade, como spinpet, baw waw, adimax pet, dentre outras."
"o adestramento para filhotes pode ser feito com petiscos sem cheiro, cor ou sabor. acima dos 3 meses de idade, e possivel oferecer snacks normalmente."
"E ideal oferecer de 2 a 10 petiscos por dia para o seu cachorro na fase de adestramento, dependendo de cada animal."
