"muitos produtos para animais agem como 2 em 1, ou seja, shampoo e condicionador em uma so composicao, facilitando no momento da higienizacao do animal e tambem na economia do comprador. algumas das marcas que proporcionam essa vantagem sao: beeps, ibasa e pet look."
"dentre quais as melhores marcas de shampoo para cachorro, podem ser encontradas diversas empresas renomadas, assim como a beeps, ibasa, pet look e centagro. ha algumas especificidades que podem ser encontradas e atendem as necessidades de determinadas racas, assim como melhor shampoo para cachorro yorkshire ou melhor shampoo para cachorro chow chow, por exemplo."
"usar shampoo de bebe em cachorro nao e recomendado, ainda que a substancia possui ph neutro, o que e indicado para que os pets nao sofram com alergias ou irritacoes, porem alguns outros componentes podem causar estes problemas. ha uma serie de opcoes de marcas para escolher o melhor shampoo para cachorro shitzu filhote ou para caes de outras racas, sendo proprios para o uso em animais."
"em relacao a quantidade de racao a ser oferecida para o seu american bully diariamente, e variavel de acordo com a sua idade, sendo que para caes ate 3 meses de vida, a quantidade gira em media de 450g por dia, diminuindo para 400g por dia entre 3 meses a 6 meses, sofrendo outra reducao ate 1 ano para 350g por dia. em relacao a quantidade de refeicoes, deve-se manter 3 vezes por dia para filhotes, podendo diminuir para 2 vezes ao dia para adultos."
"ha algumas frutas que podem ser consumidas no dia-a-dia de um american bully, sendo estas: banana, manga, melancia, goiaba, figo, ameixa, amora e caqui. algumas opcoes citricas, acidas ou com alto indice de lipidios devem ser evitadas, assim como: abacaxi, laranja, uva, jabuticaba, abacate, jambo, carambola e mamao."
"o american bully e uma raca forte por sua natureza, considerado um cao esportista e de alta performance, assim e necessario oferecer os nutrientes necessarios para que o mesmo possa manter sua estrutura. a proteina e a principal responsavel por essa manutencao dos musculos, assim escolher racoes ricas neste macronutriente e indispensavel."
"a medicao da racao pode ser feita com o auxilio de uma balanca caseira de alimento ou considerando que uma xicara possui 160g, realizando a oferta necessaria de acordo com as necessidades de seu companheiro."
"ha duas opcoes para quem busca pela melhor racao para american bully filhote, sendo a premier pet formula caes filhotes racas grandes e gigantes ou a premier golden power training caes filhotes."
"em 2020, foi assinado pelo presidente da republica e pelo pelo ministro do meio-ambiente ricardo..."
"voce ja conhece a logistica 40 com o avanco da tecnologia, a cadeia de suprimentos, producao..."
"a vacinacao salva vidas! assim como a covid-19, ao longo da historia humana muitas outras..."
"como sabemos, alguns dos fatores para a cobranca do transporte de cargas sao o peso e o volume..."
"segundo a anvisa, os produtos correlatos da area da saude sao equipamentos, aparelhos ou..."
"a gestao estrategica e um dos segredos para a execucao de servicos logisticos de qualidade,..."
"no transporte rodoviario de cargas, nao podemos simplesmente jogar as caixas dentro do caminhao..."
a seguranca e uma preocupacao recorrente de quem trabalha com servicos logisticos e...
"nao ha nada mais esperado em 2020 do que as vacinas para o coronavirus recentemente,  o brasil..."
"o bom funcionamento da logistica na area da saude nunca foi tao importante cada vez mais, os..."
"quando utilizados adequadamente, a carga de locacao e o transporte dedicado podem trazer diversos..."
voce sabia que a log10 e especializada no transporte de produtos para laboratorios estamos...
"dentro de uma empresa, o setor de servicos logisticos e responsavel por atividades essenciais..."
"voce que realiza locacao de transporte de carga, sabia que o certificado de vistoria do..."
"o setor de transporte aereo de cargas no brasil teve origem na decada de 1920, dominado por duas..."
"cif cost, insurance and freight e o termo ingles que significa: custo, seguro e frete nesta..."
o servico de motoboy  tem grande importancia na movimentacao da economia paulistana e...
"o transporte de insumos, produtos frageis ou de itens que possam sofrer facilmente alteracoes..."
o transporte de carga fracionada e modalidade que coleta quantidades pequenas de mercadoria em...
o transporte de cargas refrigeradas e congeladas e realizado em  veiculos e caminhoes que...
o ciot e a sigla para codigo de identificacao de operacao de transporte essa
em tempos de pandemia a solidariedade tornou-se mais importante do que nunca hoje queremos falar...
"vamos falar sobre os correlatos de saude conforme a definicao do inciso do decreto no 79094,..."
"em 2019, a cada hora duas transportadoras tiveram suas cargas roubadas nas rodovias brasileiras e..."
"os centros cirurgicos sao responsaveis por boa parte da receita dos hospitais, mas para..."
a extensao geografica do brasil representa um grande desafio para a logistica
"a procura por empresas de transporte de cargas aumenta a cada dia para tanto, existem inumeras..."
"em 2020, foi assinado pelo presidente da republica e pelo  pelo ministro do meio-ambiente ricardo..."
"no meio comercial da logistica, existem diversos tipos de transporte de carga entende-se por carga..."
o veiculo utilitario e um automovel que pode transportar tanto pessoas como cargas existem...
"para qualquer empresa do setor, e essencial seguir as praticas corretas de armazenamento e..."
combinar diferentes tipos de transportes de cargas pode ser a estrategia mais inteligente em...
"no meio ambiente estao todos os recursos necessarios para a sobrevivencia da especie humana,..."
o transporte just in time afeta diretamente o setor logistico de uma empresa de  transportes a...
a seguranca no transporte de equipamentos medicos e so uma das etapas que exigem atencao para...
"no dia 10 de julho comemora-se o dia mundial da saude ocular nesta data, a log 10, empresa de..."
voce ja ouviu falar em logistica promocional na area da saude o termo e usado para  dar nome...
quem trabalha com servicos logisticos ou enfrenta um grande trajeto para chegar ao emprego todos...
"como fazer cotacao de frete quando falamos em transporte de cargas, o preco do frete pode..."
"alem de possuirem funcoes esteticas, os cosmeticos provocam impacto direto na saude das..."
"voce ja parou para pensar que sem o transporte rodoviario de cargas, produtos essenciais nao..."
"separacao e expedicao para uma cirurgia de ortopedia, sao enviados ao hospital kits com..."
"produtos especiais requerem cuidados especiais, e esse e o caso dos medicamentos que precisam ser..."
"a armazenagem agrega valor ao sistema logistico, uma vez que proporciona a prestacao de..."
pensar em cada etapa do transporte de cargas e a melhor estrategia para evitar custos extras no...
"em uma empresa de transporte, a gestao de frotas define os processos e metodologias da rotina de..."
O OMD e um curso que rodou o Brasil presencialmente e agora chegou na versao online. Ele e composto por mais de 10 modulos e 50 aulas focadas em te ensinar o maximo possivel sobre o universo digital e como aplicar os conhecimentos adquiridos.
Nao. O curso sera liberado por partes e voce pode acompanhar as datas no titulo do modulo.
Sim. Em breve abriremos turmas em algumas cidades pelo Brasil. Fique ligado nas novidades.
"Voce pode pagar por cartao de credito, boleto ou transferencia bancaria."
Sim. Voce tem ate 07 dias a partir da adesao para pedir o cancelamento e o reembolso total.
Sim. Todo aluno da GREEKy ou de Parceiros tem desconto de 10 na compra de qualquer curso.
"nao  a nossa escola online oferecem auxilio e suporte tecnico no inicio do curso, para voce se familiarizar com a plataforma e os softwares. so recomendamos ter uma nocao basica de internet para o uso da plataforma."
"os cursos da escola hineni e destinada para todo aquele que deseja aprender mais da palavra de deus.se voce tem fome do vinho novo e do mover do espirito, cremos que esta plataforma online de aprendizagem pode ser de muita edificacao pra vc"
"para voce se inscrever na escola hineni precisa ingresar no menu login, que fica no canto direito da tela e logo fazer seu cadastro.aqui um video tutorial que pode te ajudar no processo de inscricao"
"sim! para alunos cadastrados que concluiram um modulo juntamente com todas as licoes de um curso,e responderem a todas as questoes do exame on-line e aprovarem o curso, cada aluno recebera seu respectivo certificado."
a maioria dos cursos online da escola hineni sao gratuitos por enquanto.no entanto contamos com a generosidade de nossos alunos para poder dar continuidade a nosso projeto de ensino apostolico.sua contribuicao e valiosa e nos permite brindar melhores condicoes e qualidade de ensino aos nossos alunos
"para falar conosco, ingresse no menu contato, clique no link e encontrara diversas opcoes para entrar em contato conosco"
proposicao: dispoe sobre a eleicao para o cargo de diretor dos hospitais da rede publica de saude do distrito federal.apresentado em: 18082020situacao: tramitandodetalhamento do pl:
"proposicao: dispoe sobre o desconto tarifario de energia eletrica sobre o consumo decorrente da utilizacao de aparelhos para tratamento de oxigenoterapia domiciliar, no ambito do distrito federal.apresentado em: 09062020situacao: tramitandodetalhamento do pl:"
proposicao: dispoe sobre a cobranca na hipotese de retorno das consultas medicas no ambito do distrito federal.apresentado em: 09062020situacao: tramitandodetalhamento do pl:
proposicao: dispoe sobre o dimensionamento da forca de trabalho dos profissionais que atuam nas unidades dos servicos hospitalares de emergencia no distrito federal.apresentado em: 19052020situacao: tramitandodetalhamento do pl:
proposicao: dispoe sobre a remuneracao do trabalho em periodo definido - tpd em situacoes de decretacao de emergencia na saude publica do distrito federal e da outras providencias.apresentado em: 28042020situacao: tramitandodetalhamento do pl:
proposicao: dispoe sobre a realizacao de testes em massa para covid-19 no ambito do distrito federal.apresentado em: 28042020situacao: vetadodetalhamento do pl:
"proposicao: assegura a concessao de descontos a clientes acompanhados de crianca, em restaurantes ou  congeneres, que servem refeicoes na modalidade 'rodizio' e 'buffet livre' no ambito do distrito federal.apresentado em: 22042020situacao: tramitandodetalhamento do pl:"
"proposicao: dispoe sobre a hospedagem gratuita para os trabalhadores da area de saude que atuam na linha de frente como medidas de precaucao ao combate a covid-19 no distrito federal, e da outras providencias.apresentado em: 07042020situacao: tramitandodetalhamento do pl:"
"proposicao: dispoe sobre a observancia, pelas unidades de saude do distrito federal, do regulamento tecnico dos sistemas estaduais de urgencia e emergencia, instituido pela portaria do ministerio da saude no 2.048, de 05 de novembro de 2002, no tocante as salas de descanso para enfermeiros, tecnicos de enfermagem e auxiliares de enfermagem.apresentado em: 10032020situacao: tramitandodetalhamento do pl:"
proposicao: dispoe sobre o plantio de semente de arvores em virtude dos nascimentos ocorridos nas unidades de saude das redes publica e privada no distrito federal.apresentado em: 19022020situacao: tramitandodetalhamento do pl:
proposicao: dispoe sobre os programas de  de recursos do governo do distrito federal na saude e na educacao e da outras providencias.apresentado em: 11022020situacao: tramitandodetalhamento do pl:
"proposicao: altera a lei no 5.730, de 24 de outubro de 2016. que dispoe sobre a cessao de uso de bens publicos imoveis do distrito federal e de suas entidades da administracao indireta.apresentado em: 05022020situacao: retiradodetalhamento do pl:"
proposicao: estabelece que o estagio nas unidades de saude da rede publica e da rede privada do distrito federal sera considerado como experiencia para concursos publicos e processos seletivos realizados no distrito federal.apresentado em: 04022020situacao: em tramitacaodetalhamento do pl:
proposicao: dispoe sobre a instituicao do programa de incentivo a atividade fisica para idosos no ambito do distrito federal.apresentado em: 04022020situacao: em tramitacaodetalhamento do pl:
"proposicao:assegura aos profissionais da saude, do sistema publico e privado de saude do distrito federal, o direito a meia-entrada na aquisicao de ingressos para eventos artisticos, culturais,  e desportivos realizados no distrito federal.apresentado em: 261119situacao: em tramitacaodetalhamento do pl:"
"proposicao:dispoe sobre a garantia de acesso e permanencia de ambos os pais ou responsavel acompanhando pacientes, menores de idade, no decorrer de consultas nas unidades de saude das redes publica e privada do distrito federal.apresentado em: 261119situacao: em tramitacaodetalhamento do pl:"
proposicao:assegura as gestantes a realizacao da  morfologica na rede publica de saude do distrito federal.apresentado em: 281119situacao: vetadodetalhamento do pl:
"proposicaoinstitui e inclui no calendario oficial do distrito federal a 'semana da enfermagem', a ser celebrado, anualmente, nos dias 12 a 20 de maio.apresentado em: 230419situacao: lei 64762020publ dodf 070120 norm n. 4 pag: 1 col: 1 - diario oficial do distrito federaldetalhamento do pl:"
"proposicaocria o programa remedio para todos, que garante o acesso gratuito dos usuarios do sistema unico de saude - sus - a medicamentos e insumos nao fornecidos, por motivo de falta de disponibilidade em estoque, nas unidades e  da rede publica de saude do distrito federal.apresentado em: 100419situacao: lei 63792019publ dcl 060819 n. 162 p. 15 - redacao finalpubl dcl 240919 n. 198 p. 7 - promulgacaopubl dodf 270919 n. 185 p. 2 - promulgacaodetalhamento do pl:"
proposicaoestabelece os valores minimos de retiradas aplicaveis as cooperativas de trabalho constituidas para prestacao do servico de home care no distrito federal.apresentado em: 090419situacao: lei 65982020publ dodf 160620 norm n. 111 pag: 1 col: 2 - diario oficial do distrito federalpubl dcl 090620 norm n. 132 pag: 4 col: 1 - diario da camara legislativadetalhamento do pl:
"proposicaoinstitui e inclui no calendario oficial do distrito federal o 'dia do tecnico e auxiliar de enfermagem, a ser comemorado, anualmente, no dia 20 de maio.apresentado em: 020419situacao: em tramitacaodetalhamento do pl:"
"proposicaoinstitui e inclui no calendario oficial do distrito federal o ''dia do enfermeiro'', a ser comemorado, anualmente, no dia 12 de maio.apresentado em: 020419situacao: em tramitacaodetalhamento do pl:"
"proposicaoproibe o assedio moral nas unidades e  das redes publica e privada de saude do distrito federal, e da outras providencias.apresentado em: 190319situacao: vetadodetalhamento do pl:"
proposicaoinstitui a politica distrital de seguranca e saude no trabalho - pdsst no ambito da administracao publica direta e indireta do distrito federal.apresentado em: 190219situacao: lei 63932019 sancionada em 04102019publ dcl 240619 n. 128 p. 7 - redacao finalpubl dcl 071019 n. 207 p. 4 - promulgacaodetalhamento do pl:
proposicaoassegura a  de profissional apto a se comunicar na lingua brasileira de sinais - libras nas unidades e nos orgaos da rede publica de saude do distrito federal que prestam atendimento a populacao.apresentado em: 050219situacao: lei 63002019 sancionada em 070519publ dcl 120419 n. 77 p. 4 - redacao finalpubl dodf 070519 n. 84 p. 1 - sancaodetalhamento do pl:
"proposicaoassegura, para as pessoas com deficiencia, a reserva de, no minimo, 10 dos cargos em comissao e das funcoes de confianca de orgao ou entidade da administracao publica direta ou indireta de qualquer dos poderes do distrito federal.apresentado em: 050219situacao: vetadodetalhamento do pl:"
"proposicaoaltera a lei no 4.317, de 9 de abril de 2009, que 'institui a politica distrital para integracao da pessoa com deficiencia, consolida as normas de protecao e da outras providencias', com o objetivo de estender gratuidade no servico de transporte publico as pessoas de baixa renda com doencas degenerativas.apresentado em: 050219situacao: em tramitacaodetalhamento do pl:"
"proposicaoobriga os  que comercializam pneus a receber os pneus usados dos clientes que nao mais desejam sua posse, e da outras providencias.apresentado em: 050219situacao: prejudicadodetalhamento do pl:"
"proposicaoobriga as pessoas fisicas e juridicas que realizam eventos com acesso aberto ao publico a conferir tratamento preferencial a gestantes, pessoas acompanhadas de criancas no colo, idosos, pessoas com deficiencia e pessoas com enfermidade que diminua a capacidade de locomocao, inclusive obesidade.apresentado em: 050219situacao: prejudicadodetalhamento do pl:"
proposicao: estabelece que o estagio nas unidades de saude da rede publica e da rede privada do distrito federal sera considerado como experiencia para concursos publicos e processos seletivos realizados no distrito federal.apresentado em: 04022020situacao: em tramitacaodetalhamento do pl:
proposicao: dispoe sobre a instituicao do programa de incentivo a atividade fisica para idosos no ambito do distrito federal.apresentado em: 04022020situacao: em tramitacaodetalhamento do pl:
"proposicao:assegura aos profissionais da saude, do sistema publico e privado de saude do distrito federal, o direito a meia-entrada na aquisicao de ingressos para eventos artisticos, culturais,  e desportivos realizados no distrito federal.apresentado em: 261119situacao: em tramitacaodetalhamento do pl:"
"proposicao:dispoe sobre a garantia de acesso e permanencia de ambos os pais ou responsavel acompanhando pacientes, menores de idade, no decorrer de consultas nas unidades de saude das redes publica e privada do distrito federal.apresentado em: 261119situacao: em tramitacaodetalhamento do pl:"
proposicao:assegura as gestantes a realizacao da  morfologica na rede publica de saude do distrito federal.apresentado em: 281119situacao: em tramitacaodetalhamento do pl:
"proposicaoinstitui e inclui no calendario oficial do distrito federal a 'semana da enfermagem', a ser celebrado, anualmente, nos dias 12 a 20 de maio.apresentado em: 230419situacao: aprovado, encaminhado para sancao do governadordetalhamento do pl:"
"proposicaocria o programa remedio para todos, que garante o acesso gratuito dos usuarios do sistema unico de saude - sus - a medicamentos e insumos nao fornecidos, por motivo de falta de disponibilidade em estoque, nas unidades e  da rede publica de saude do distrito federal.apresentado em: 100419situacao: lei 63792019publ dcl 060819 n. 162 p. 15 - redacao finalpubl dcl 240919 n. 198 p. 7 - promulgacaopubl dodf 270919 n. 185 p. 2 - promulgacaodetalhamento do pl:"
"proposicaoestabelece os valores minimos de retiradas aplicaveis as cooperativas de trabalho constituidas para prestacao do servico de home care no distrito federal.apresentado em: 090419situacao: aprovado, encaminhado para sancao do governadordetalhamento do pl:"
"proposicaoinstitui e inclui no calendario oficial do distrito federal o 'dia do tecnico e auxiliar de enfermagem, a ser comemorado, anualmente, no dia 20 de maio.apresentado em: 020419situacao: em tramitacaodetalhamento do pl:"
"estou bem também, obrigado por perguntar"
"O deserto do Saara é o maior deserto quente do mundo, com uma extensão de aproximadamente 9,2 milhões de quilômetros quadrados (ou 3,6 milhões de milhas quadradas). Ele cobre grande parte do norte da África, abrangendo vários países, incluindo Argélia, Chade, Egito, Líbia, Mali, Mauritânia, Marrocos, Níger, Saara Ocidental, Sudão e Tunísia. Para comparação, o Saara tem uma área semelhante à dos Estados Unidos ou à da China, tornando-o um dos maiores desertos do planeta, superado apenas pelos desertos frios da Antártida e do Ártico em termos de área total."
"proposicaoinstitui e inclui no calendario oficial do distrito federal o ''dia do enfermeiro'', a ser comemorado, anualmente, no dia 12 de maio.apresentado em: 020419situacao: em tramitacaodetalhamento do pl:"
"proposicaoproibe o assedio moral nas unidades e  das redes publica e privada de saude do distrito federal, e da outras providencias.apresentado em: 190319situacao: vetadodetalhamento do pl:"
proposicaoinstitui a politica distrital de seguranca e saude no trabalho - pdsst no ambito da administracao publica direta e indireta do distrito federal.apresentado em: 190219situacao: lei 63932019 sancionada em 04102019publ dcl 240619 n. 128 p. 7 - redacao finalpubl dcl 071019 n. 207 p. 4 - promulgacaodetalhamento do pl:
proposicaoassegura a  de profissional apto a se comunicar na lingua brasileira de sinais - libras nas unidades e nos orgaos da rede publica de saude do distrito federal que prestam atendimento a populacao.apresentado em: 050219situacao: lei 63002019 sancionada em 070519publ dcl 120419 n. 77 p. 4 - redacao finalpubl dodf 070519 n. 84 p. 1 - sancaodetalhamento do pl:
"proposicaoassegura, para as pessoas com deficiencia, a reserva de, no minimo, 10 dos cargos em comissao e das funcoes de confianca de orgao ou entidade da administracao publica direta ou indireta de qualquer dos poderes do distrito federal.apresentado em: 050219situacao: vetadodetalhamento do pl:"
"proposicaoaltera a lei no 4.317, de 9 de abril de 2009, que 'institui a politica distrital para integracao da pessoa com deficiencia, consolida as normas de protecao e da outras providencias', com o objetivo de estender gratuidade no servico de transporte publico as pessoas de baixa renda com doencas degenerativas.apresentado em: 050219situacao: em tramitacaodetalhamento do pl:"
"proposicaoobriga os  que comercializam pneus a receber os pneus usados dos clientes que nao mais desejam sua posse, e da outras providencias.apresentado em: 050219situacao: em tramitacaodetalhamento do pl:"
"proposicaoobriga as pessoas fisicas e juridicas que realizam eventos com acesso aberto ao publico a conferir tratamento preferencial a gestantes, pessoas acompanhadas de criancas no colo, idosos, pessoas com deficiencia e pessoas com enfermidade que diminua a capacidade de locomocao, inclusive obesidade.apresentado em: 050219situacao: em tramitacaodetalhamento do pl:"
"altera o art. 6o da lei no 4.949, de 15 de outubro de 2012, que  'estabelece normas gerais para realizacao de concurso publico pela administracao direta, autarquica e fundacional do distrito federal' para garantir a pessoa com deficiencia surda a realizacao da prova na lingua brasileira de sinais - libras.apresentado em: 011019situacao: em tramitacaodetalhamento do pl:"
"assegura, em carater indenizatorio, o fardamento uniforme para os profissionais que desempenham suas atribuicoes na secretaria de estado de saude do distrito federal e no servico de atendimento movel de urgencia do distrito federal - samu-df.apresentado em: 030919situacao: em tramitacaodetalhamento do pl:"
institui a politica distrital de reducao do desperdicio de alimentos e da outras providencias.apresentado em: 060819situacao: em tramitacaodetalhamento do pl:
"institui e inclui no calendario oficial do distrito federal o 'dia do medico', a ser celebrado, anualmente, no dia 18 de outubro.apresentado em: 040619situacao: em tramitacaodetalhamento do pl:"
dispoe sobre a avaliacao psicologica de gestantes e puerperas.apresentado em: 210519situacao: em tramitacaodetalhamento do pl:
"institui e inclui no calendario oficial do distrito federal o 'dia dos profissionais de enfermagem forense', a ser celebrado, anualmente, no dia 25 de novembro.apresentado em: 210519situacao: em tramitacaodetalhamento do pl:"
"garante, no ambito do distrito federal, direitos das pessoas surdas ou com deficiencia auditiva, efetiva os direitos de igualdade e acessibilidade das pessoas com deficiencia nos concursos publicos realizados pela administracao direta, autarquica e fundacional do distrito federal, e da outras providencias.apresentado em: 070519situacao: em tramitacaodetalhamento do pl:"
"dispoe sobre a criacao de cargos publicos na area de enfermagem forense, e da outras providencias.apresentado em: 250419situacao: em tramitacaodetalhamento do pl:"
"institui e inclui no calendario oficial do distrito federal o 'dia do tecnico e auxiliar de enfermagem, a ser comemorado, anualmente, no dia 20 de maio.apresentado em: 020419situacao: em tramitacaodetalhamento do pl:"
"institui e inclui no calendario oficial do distrito federal o ''dia do enfermeiro'', a ser comemorado, anualmente, no dia 12 de maio.apresentado em: 020419situacao: em tramitacaodetalhamento do pl:"
"proibe o assedio moral nas unidades e  das redes publica e privada de saude do distrito federal, e da outras providencias.apresentado em: 190319situacao: vetadodetalhamento do pl:"
"assegura, para as pessoas com deficiencia, a reserva de, no minimo, 10 dos cargos em comissao e das funcoes de confianca de orgao ou entidade da administracao publica direta ou indireta de qualquer dos poderes do distrito federal.apresentado em: 050219situacao: vetadodetalhamento do pl:"
"altera a lei no 4.317, de 9 de abril de 2009, que 'institui a politica distrital para integracao da pessoa com deficiencia, consolida as normas de protecao e da outras providencias', com o objetivo de estender gratuidade no servico de transporte publico as pessoas de baixa renda com doencas degenerativas.apresentado em: 050219situacao: em tramitacaodetalhamento do pl:"
"obriga os  que comercializam pneus a receber os pneus usados dos clientes que nao mais desejam sua posse, e da outras providencias.apresentado em: 050219situacao: em tramitacaodetalhamento do pl:"
