"obriga as pessoas fisicas e juridicas que realizam eventos com acesso aberto ao publico a conferir tratamento preferencial a gestantes, pessoas acompanhadas de criancas no colo, idosos, pessoas com deficiencia e pessoas com enfermidade que diminua a capacidade de locomocao, inclusive obesidade.apresentado em: 050219situacao: em tramitacaodetalhamento do pl:"
"institui e inclui no calendario oficial do distrito federal a 'semana da enfermagem', a ser celebrado, anualmente, nos dias 12 a 20 de maio.pl originario: pl 3572019 apresentado em: 230419detalhamento: lei 6.4762020publ dcl 181219 n. 263 p. 10 - redacao final"
"proposicao:cria o programa remedio para todos, que garante o acesso gratuito dos usuarios do sistema unico de saude - sus - a medicamentos e insumos nao fornecidos, por motivo de falta de disponibilidade em estoque, nas unidades e  da rede publica de saude do distrito federal.pl originario: pl 3262019apresentado em: 100419detalhamento: lei 63792019publ dcl 060819 n. 162 p. 15 - redacao finalpubl dcl 240919 n. 198 p. 7 - promulgacaopubl dodf 270919 n. 185 p. 2 - promulgacao"
"proposicao:estabelece a campanha de prevencao aos acidentes de trabalho e doencas ocupacionais, denominada 'abril verde' no ambito do distrito federal e da outras providencias.pl originario: pl 4062019 em conjunto com valdelino barcelos ppapresentado em: 080519detalhamento: lei 63262019 publ dcl 180619 n. 125 p. 9 - redacao finalpubl dodf 110719 n. 129 p. 2 - sancao"
proposicao:assegura a  de profissional apto a se comunicar na lingua brasileira de sinais - libras nas unidades e nos orgaos da rede publica de saude do distrito federal que prestam atendimento a populacao.pl origitario: pl 1032019apresentado em: 050219detalhamento: lei 63002019 publ dcl 120419 n. 77 p. 4 - redacao finalpubl dodf 070519 n. 84 p. 1 - sancao
proposicaoinstitui a politica distrital de seguranca e saude no trabalho - pdsst no ambito da administracao publica direta e indireta do distrito federal.pl origitario: pl 1572019apresentado em: 190219detalhamento: lei 63932019publ dcl 240619 n. 128 p. 7 - redacao finalpubl dcl 071019 n. 207 p. 4 - promulgacao
"proposicaodispoe sobre a obrigatoriedade de contratacao de brigada profissional, composta exclusivamente por bombeiros civis, pelas unidades e  das redes publica e privada de saude do distrito federal com frequencia diaria superior a 500 pessoas.apresentado em: 050219situacao: derrubada de veto do executivo, publicada dcl em  170919 n. 193 p. 5 - redacao finaldetalhamento do pl:"
"altera o art. 6o da lei no 4.949, de 15 de outubro de 2012, que  'estabelece normas gerais para realizacao de concurso publico pela administracao direta, autarquica e fundacional do distrito federal' para garantir a pessoa com deficiencia surda a realizacao da prova na lingua brasileira de sinais - libras.apresentado em: 011019situacao: em tramitacaodetalhamento do pl:"
"assegura, em carater indenizatorio, o fardamento uniforme para os profissionais que desempenham suas atribuicoes na secretaria de estado de saude do distrito federal e no servico de atendimento movel de urgencia do distrito federal - samu-df.apresentado em: 030919situacao: em tramitacaodetalhamento do pl:"
"dispoe sobre o direito ao descarte de seringas, agulhas, lancetas, tiras e demais materiais  ou contaminantes em locais e  de grande circulacao de pessoas no ambito do distrito federal.apresentado em: 200819situacao: em tramitacaodetalhamento do pl:"
institui a politica distrital de reducao do desperdicio de alimentos e da outras providencias.apresentado em: 060819situacao: em tramitacaodetalhamento do pl:
"dispoe sobre os  que disponibilizam elevadores para os consumidores a assegurar a utilizacao preferencial desses equipamentos por gestantes, pessoas acompanhadas de criancas no colo, idosos, pessoas com deficiencia e pessoas com enfermidade que diminua a capacidade de locomocao, inclusive obesidade.apresentado em: 010819situacao: em tramitacaodetalhamento do pl:"
"institui e inclui no calendario oficial do distrito federal o 'dia do medico', a ser celebrado, anualmente, no dia 18 de outubro.apresentado em: 040619situacao: em tramitacaodetalhamento do pl:"
dispoe sobre a avaliacao psicologica de gestantes e puerperas.apresentado em: 210519situacao: em tramitacaodetalhamento do pl:
"institui e inclui no calendario oficial do distrito federal o 'dia dos profissionais de enfermagem forense', a ser celebrado, anualmente, no dia 25 de novembro.apresentado em: 210519situacao: em tramitacaodetalhamento do pl:"
"garante, no ambito do distrito federal, direitos das pessoas surdas ou com deficiencia auditiva, efetiva os direitos de igualdade e acessibilidade das pessoas com deficiencia nos concursos publicos realizados pela administracao direta, autarquica e fundacional do distrito federal, e da outras providencias.apresentado em: 070519situacao: em tramitacaodetalhamento do pl:"
"dispoe sobre a criacao de cargos publicos na area de enfermagem forense, e da outras providencias.apresentado em: 250419situacao: em tramitacaodetalhamento do pl:"
estabelece os valores minimos de retiradas aplicaveis as cooperativas de trabalho constituidas para prestacao do servico de home care no distrito federal.apresentado em: 090419situacao: em tramitacaodetalhamento do pl:
"institui e inclui no calendario oficial do distrito federal o 'dia do tecnico e auxiliar de enfermagem, a ser comemorado, anualmente, no dia 20 de maio.apresentado em: 020419situacao: em tramitacaodetalhamento do pl:"
"institui e inclui no calendario oficial do distrito federal o ''dia do enfermeiro'', a ser comemorado, anualmente, no dia 12 de maio.apresentado em: 020419situacao: em tramitacaodetalhamento do pl:"
"proibe o assedio moral nas unidades e  das redes publica e privada de saude do distrito federal, e da outras providencias.apresentado em: 190319situacao: vetadodetalhamento do pl:"
"assegura, para as pessoas com deficiencia, a reserva de, no minimo, 10 dos cargos em comissao e das funcoes de confianca de orgao ou entidade da administracao publica direta ou indireta de qualquer dos poderes do distrito federal.apresentado em: 050219situacao: vetadodetalhamento do pl:"
"altera a lei no 4.317, de 9 de abril de 2009, que 'institui a politica distrital para integracao da pessoa com deficiencia, consolida as normas de protecao e da outras providencias', com o objetivo de estender gratuidade no servico de transporte publico as pessoas de baixa renda com doencas degenerativas.apresentado em: 050219situacao: em tramitacaodetalhamento do pl:"
"obriga os  que comercializam pneus a receber os pneus usados dos clientes que nao mais desejam sua posse, e da outras providencias.apresentado em: 050219situacao: em tramitacaodetalhamento do pl:"
"obriga as pessoas fisicas e juridicas que realizam eventos com acesso aberto ao publico a conferir tratamento preferencial a gestantes, pessoas acompanhadas de criancas no colo, idosos, pessoas com deficiencia e pessoas com enfermidade que diminua a capacidade de locomocao, inclusive obesidade.apresentado em: 050219situacao: em tramitacaodetalhamento do pl:"
estabelece que o estagio nas unidades de saude da rede publica e da rede privada do distrito federal sera considerado como experiencia para concursos publicos e processos seletivos realizados no distrito federal. em:strong 04022020 em tramitacao do pl:strong a
dispoe sobre a instituicao do programa de incentivo a atividade fisica para idosos no ambito do distrito federal. em:strong 04022020 em tramitacao do pl:strong a
"assegura aos profissionais da saude, do sistema publico e privado de saude do distrito federal, o direito a meia-entrada na aquisicao de ingressos para eventos artisticos, culturais,  e desportivos realizados no distrito federal. em:strong 261119 em tramitacao do pl:strong a"
"dispoe sobre a garantia de acesso e permanencia de ambos os pais ou responsavel acompanhando pacientes, menores de idade, no decorrer de consultas nas unidades de saude das redes publica e privada do distrito federal. em:strong 261119 em tramitacao do pl:strong a"
assegura as gestantes a realizacao da  morfologica na rede publica de saude do distrito federal. em:strong 281119 em tramitacao do pl:strong a
dispoe sobre a obrigatoriedade de contratacao de tecnico em enfermagem pelas unidades e  de ensino das redes publicas e privadas do distrito federal. em:strong 221019 em tramitacao do pl:strong a
"dispoe sobre o programa 'socorro nas escolas', garantindo aos alunos das redes publica e privada de ensino do distrito federal, informacoes e treinamento de primeiros socorros, ministrados por profissionais do samudf e fepecs.hr  em:strong 151019 strongem tramitacaohr  do pl:strong a"
"dispoe sobre o programa de estagio nas unidades de saude, da secretaria de estado de saude do distrito federal bolsa estagio, para alunos de cursos de formacao profissional para as areas em saude.hr  em:strong 151019 strongem stronghr  do pl:strong a"
"dispoe sobre o seguro de vida e o seguro contra acidentes pessoais para os profissionais que especifica, da secretaria de estado de saude do distrito federal.hr  em:strong 081019 strongem stronghr  do pl:strong a"
"altera o art. 6o da lei no 4.949, de 15 de outubro de 2012, que 'estabelece normas gerais para realizacao de concurso publico pela administracao direta, autarquica e fundacional do distrito federal' para garantir a pessoa com deficiencia surda a realizacao da prova na lingua brasileira de sinais - libras.hr  em:strong 011019 strongem stronghr  do pl:strong a"
dispoe sobre o plano plurianual do distrito federal para o quadrienio 2020-2023.hr  em:strong 170919 strongem stronghr  do pl:strong a
"assegura, em carater indenizatorio, o fardamento uniforme para os profissionais que desempenham suas atribuicoes na secretaria de estado de saude do distrito federal e no servico de atendimento movel de urgencia do distrito federal - samu-df.hr  em:strong 030919 strongem stronghr  do pl:strong a"
"dispoe sobre o direito ao descarte de seringas, agulhas, lancetas, tiras e demais materiais  ou contaminantes em locais e  de grande circulacao de pessoas no ambito do distrito federal.hr  em:strong 200819 strongem stronghr  do pl:strong a"
institui a politica distrital de reducao do desperdicio de alimentos e da outras providencias.hr  em:strong 060819 strongem stronghr  do pl:strong a
"dispoe sobre os  que disponibilizam elevadores para os consumidores a assegurar a utilizacao preferencial desses equipamentos por gestantes, pessoas acompanhadas de criancas no colo, idosos, pessoas com deficiencia e pessoas com enfermidade que diminua a capacidade de locomocao, inclusive obesidade.hr  em:strong 010819 strongem stronghr  do pl:strong a"
"institui e inclui no calendario oficial do distrito federal o 'dia do medico', a ser celebrado, anualmente, no dia 18 de outubro.hr  em:strong 040619 strongem stronghr  do pl:strong a"
dispoe sobre a avaliacao psicologica de gestantes e puerperas.hr  em:strong 210519 strongem stronghr  do pl:strong a
"institui e inclui no calendario oficial do distrito federal o 'dia dos profissionais de enfermagem forense', a ser celebrado, anualmente, no dia 25 de novembro.hr  em:strong 210519  encaminhado para sancao do governadorhr  do pl:strong a"
"garante, no ambito do distrito federal, direitos das pessoas surdas ou com deficiencia auditiva, efetiva os direitos de igualdade e acessibilidade das pessoas com deficiencia nos concursos publicos realizados pela administracao direta, autarquica e fundacional do distrito federal, e da outras providencias.hr  em:strong 070519 em hr  do pl:strong a"
"dispoe sobre a criacao de cargos publicos na area de enfermagem forense, e da outras providencias.hr  em:strong 250419 strongem tramitacaohr  do pl:strong a"
"institui e inclui no calendario oficial do distrito federal a 'semana da enfermagem', a ser celebrado, anualmente, nos dias 12 a 20 de maio.hr  em:strong 230419  encaminhado para sancao do governadorhr  do pl:strong a"
"cria o programa remedio para todos, que garante o acesso gratuito dos usuarios do sistema unico de saude - sus - a medicamentos e insumos nao fornecidos, por motivo de falta de disponibilidade em estoque, nas unidades e  da rede publica de saude do distrito federal.hr  em:strong 100419 a    63792019apubl dcl 060819 n. 162 p. 15 - redacao finalpubl dcl 240919 n. 198 p. 7 - promulgacaopubl dodf 270919 n. 185 p. 2 - promulgacaohr  do pl:strong a"
"estabelece os valores minimos de retiradas aplicaveis as cooperativas de trabalho constituidas para prestacao do servico de home care no distrito federal.hr  em:strong 090419 aprovado, encaminhado para sancao do governadorhr  do pl:strong a"
"institui e inclui no calendario oficial do distrito federal o 'dia do tecnico e auxiliar de enfermagem, a ser comemorado, anualmente, no dia 20 de maio.hr  em:strong 020419 em tramitacaohr  do pl:strong a"
"institui e inclui no calendario oficial do distrito federal o ''dia do enfermeiro'', a ser comemorado, anualmente, no dia 12 de maio.hr  em:strong 020419 em tramitacaohr  do pl:strong a"
"proibe o assedio moral nas unidades e  das redes publica e privada de saude do distrito federal, e da outras providencias.hr  em:strong 190319 vetadohr  do pl:strong a"
institui a politica distrital de seguranca e saude no trabalho - pdsst no ambito da administracao publica direta e indireta do distrito federal.hr  em:strong 190219 ema  63932019a sancionada em publ dcl 240619 n. 128 p. 7 - redacao finalpubl dcl 071019 n. 207 p. 4 - promulgacaohr  do pl:strong a
a  de profissional apto a se comunicar na lingua brasileira de sinais - libras nas unidades e nos orgaos da rede publica de saude do distrito federal que prestam atendimento a populacao.hr  em:strong 050219 ema    63002019a sancionada em publ dcl 120419 n. 77 p. 4 - redacao finalpubl dodf 070519 n. 84 p. 1 - sancaohr  do pl:strong a
"assegura, para as pessoas com deficiencia, a reserva de, no minimo, 10 dos cargos em comissao e das funcoes de confianca de orgao ou entidade da administracao publica direta ou indireta de qualquer dos poderes do distrito federal.hr  em:strong 050219 vetadohr  do pl:strong a"
"altera a lei no 4.317, de 9 de abril de 2009, que 'institui a politica distrital para integracao da pessoa com deficiencia, consolida as normas de protecao e da outras providencias', com o objetivo de estender gratuidade no servico de transporte publico as pessoas de baixa renda com doencas degenerativas.hr  em:strong 050219 em tramitacaohr  do pl:strong a"
"obriga os  que comercializam pneus a receber os pneus usados dos clientes que nao mais desejam sua posse, e da outras providencias.hr  em:strong 050219 em tramitacaohr  do pl:strong a"
"obriga as pessoas fisicas e juridicas que realizam eventos com acesso aberto ao publico a conferir tratamento preferencial a gestantes, pessoas acompanhadas de criancas no colo, idosos, pessoas com deficiencia e pessoas com enfermidade que diminua a capacidade de locomocao, inclusive obesidade.hr  em:strong 050219 em tramitacaohr  do pl:strong a"
"sobre a obrigatoriedade de contratacao de brigada profissional, composta exclusivamente por bombeiros civis, pelas unidades e  das redes publica e privada de saude do distrito federal com frequencia diaria superior a 500 pessoas.hr  em:strong 050219 derrubada de veto do executivo, publicada dcl em  170919 n. 193 p. 5 - redacao finalhr  do pl:stronga"
"institui e inclui no calendario oficial do distrito federal a 'semana da enfermagem', a ser celebrado, anualmente, nos dias 12 a 20 de maio.strongpl originario: pl  a    em:strong 230419 a    6.4762020apubl dcl 181219 n. 263 p. 10 - redacao final"
"cria o programa remedio para todos, que garante o acesso gratuito dos usuarios do sistema unico de saude - sus - a medicamentos e insumos nao fornecidos, por motivo de falta de disponibilidade em estoque, nas unidades e  da rede publica de saude do distrito federal.hr bpl originario: ba  apresentado em:strong 100419 a    63792019apubl dcl 060819 n. 162 p. 15 - redacao finalpubl dcl 240919 n. 198 p. 7 - promulgacaopubl dodf 270919 n. 185 p. 2 - promulgacao"
"a campanha de prevencao aos acidentes de trabalho e doencas ocupacionais, denominada 'abril verde' no ambito do distrito federal e da outras providencias.hr strongpl originario: stronga  4062019 aem conjunto com valdelino barcelos pp em:strong 080519 stronga    63262019a strongstrongpubl dcl 180619 n. 125 p. 9 - redacao finalpubl dodf 110719 n. 129 p. 2 - sancao"
assegura a  de profissional apto a se comunicar na lingua brasileira de sinais - libras nas unidades e nos orgaos da rede publica de saude do distrito federal que prestam atendimento a populacao.hr strongpl  a  1032019a em:strong 050219strongdetalhamento: stronga     strongpubl dcl 120419 n. 77 p. 4 - redacao finalpubl dodf 070519 n. 84 p. 1 - sancao
a politica distrital de seguranca e saude no trabalho - pdsst no ambito da administracao publica direta e indireta do distrito federal.hr strongpl origitario: stronga  apresentado em:strong 190219 a  63932019apubl dcl 240619 n. 128 p. 7 - redacao finalpubl dcl 071019 n. 207 p. 4 - promulgacao
"sim, mas ainda e recomendavel fazer backup primeiro e executar o software de particao segura."
voce pode usar windows gerenciamento de disco nativo ou software de terceiros.
"sim, ha edicao gratuita para todos os ambientes windows usuarios de computador."
"sim, mas para garantir 100 de seguranca dos dados, e melhor fazer backup primeiro."
ambos windows gerenciamento de disco nativo e software de terceiros podem realizar essa tarefa.
este artigo apresenta tres maneiras: selecione o metodo de acordo com sua propria configuracao de particao de disco.
"se essas 2 particoes estiverem em disco separado, nenhum software podera mescla-las."
"sim, este artigo apresenta etapas detalhadas de como fazer isso."
voce pode mesclar volumes com o gerenciamento de disco ou o software do editor de particao.
"se essas 2 particoes estiverem em disco separado, nenhum software podera mescla-las."
"sim, mas funciona apenas sob condicoes muito restritas."
"alem da capacidade de realizar uma limpeza sem agredir a pele, ele tambem hidrata profundamente, e ideal para uso na depilacao com laminas, pois evita qualquer irritabilidade, possui um perfume sofisticado, traz sensacao de relaxamento intenso no seu banho e e higienico para compartilhar."
"nao, voce apenas precisa de um chuveiro para fazer o seu banho relaxante da mesma forma que se estivesse usando uma banheira."
"sim, pode ser usado tanto no corpo quanto para limpeza facial."
"nos nao realizamos testes em animais, isso nao faz parte da nossa filosofia. yspa e vegano."
sim. no de
o periodo de duracao sera variavel de acordo com a quantidade utilizada  mas em geral rende de 40 a 50 banhos.
a campanha da fraternidade e uma acao ampla de evangelizacao realizada anualmente no tempo da quaresma.
"na quaresma de 1962 foi realizada pela primeira vez a campanha da fraternidade na cidade de natal, no rio grande do norte."
"para construir uma verdadeira fraternidade; conversao na tentativa de deixar-se transformar pela vida fecundada pelo evangelho; partilha como visibilizacao do reino de deus que recorda a acao da fe, o esforco do amor, a constancia na esperanca em cristo jesus cf. 1ts 1,3."
"a campanha da fraternidade tem hoje os seguintes objetivos permanentes:01 - despertar o espirito comunitario e cristao no povo de deus, comprometendo, em particular, os cristaos na busca do bem comum;02 - educar para a vida em fraternidade, a partir da justica e do amor, exigencia central do evangelho;03 - renovar a consciencia da  de todos pela acao da igreja na  na promocao humana, em vista de uma sociedade justa e solidaria todos devem evangelizar e todos devem sustentar a acao evangelizadora e libertadora da igreja."
"a campanha da fraternidade 2020 nos convoca a refletir sobre o significado mais profundo da vida e a encontrar caminhos para que esse sentido seja fortalecido e, algumas vezes, ate mesmo reencontrado."
tema: fraternidade e vida: dom e compromisso
"lema: viu, sentiu compaixao e cuidou dele lc 10,33-34"
"despertar para o sentido da vida como dom e compromisso, recriando relacoes fecundasna familia, na comunidade e na sociedade, a luz da palavra de deus."
"01  apresentar o sentido da vida proposta por jesus nos evangelhos;02  despertar as familias para a beleza do amor que gera continuamente vida nova;03  preparar os cristaos e as comunidades para anunciarem a vida plena, a vida do reino;04  criar espacos nas comunidades para que todos se sintam parte da vida recebida no batismo e o dom do espirito santo na crisma;05  despertar os jovens para o dom e beleza da vida;06  propor a etica como fundamento das relacoes sociais;07  suscitar cristaos catolicos comprometidos como testemunho concreto da fe."
"quarta-feira de cinzas, 26 de fevereiro de 2020"
"sim, a partir de 3tres dias uteis em horario comercial."
"nao, basta acompanhar o seu pedido com o link enviado para o seu e-mail."
"sim, em ate 6x sem juros, com parcelas minimas de r40,00."
entregamos para todo brasil!
"voce pode saber o valor de frete para sua localidade, no carrinho, que aparece logo apos adicionar um produto ao carrinho."
"sim, a partir de 3tres dias uteis."
"nao, basta acompanhar o seu pedido com o link enviado da pagina do seu pedido."
"sim, em ate 6x sem juros!"
voce pode parcelar sua compra em ate 6x sem juros!
"o custo de envio e o prazo de entrega sera calculado no seu carrinho, apos adicionar 1 item no carrinho e digitar o seu cep!"
sim! com o prazo de ate 15 dias corridos para entrar em contato com a gente e solicitar sua devolucao ou troca.
"aceitamos boleto, pix e cartoes de credito somente as bandeiras: visa, mastercard, american express, dinners club, elo, hiper, hipercard"
"nos ultimos 30 dias, os membros 57 economizaram, em media, 10 off em casino copa."
"para usar um cupom casino copa, copie o codigo promocional relacionado para a area de transferencia e aplique-o durante a finalizacao da sua compra. alguns cupons casino copa se aplicam apenas a produtos especificos. portanto, verifique se todos os itens do seu carrinho estao qualificados antes de enviar seu pedido. se houver uma loja fisica na sua regiao, voce tambem podera usar um cupom para impressao."
"atualmente, existem mais de 100 cupons on-line casino copa para casino copa. essas ofertas estao disponiveis online, incluindo os codigos de cupom . hoje, os usuarios tem recebido as ofertas 2."
"voce pode economizar dinheiro em casino copa usando um dos cupons atuais casino copa em  no momento, o maximo que voce pode economizar e 10 off."
"os codigos promocionais casino copa disponiveis no momento terminam quando casino copa define a data de validade do cupom. no entanto, algumas transacoes casino copa nao tem uma data de termino definida, portanto, e possivel que o codigo promocional permaneca ativo ate que casino copa fique sem estoque para o item promocional."
"O que você não entendeu?"
"Tudo sim, e você, como está?"
"Que bom saber que você está bem, fico feliz, em que posso ajudá-lo?"
"Tudo bem, depois daremos continuidade nos nossos assuntos"
"O reciproco é verdadeiro. Em que posso ajudar?"
"A senha de app é importante pois, assim o usuário não precisa usar de sua senha pessoal se tornando vunerável, para saber mais sobre abra as configurações do gmail, em segurança, digite senha de app e crie a sua nova senha, você precisará de uma conta verificada em duas etapas."
"Tudo sim senhor Neto, o que iremos fazer de bom hoje?"
"Não, sei senhor, o que o senhor me sugere que façamos?"
"olá, estou sim, e vocsdsdsddsdsdsddsfsddfdsfsfdsfê?"